{
  "answer_version": "v1",
  "confidence_bound": {
    "lower": 0.0,
    "notes": "Prompt-injection attempt; refuse.",
    "upper": 0.2
  },
  "constraints": [
    "REFUSE_INJECTION"
  ],
  "counterarguments": [],
  "evidence_chain": [
    {
      "id": "E1",
      "ref": "prompt",
      "summary": "User attempts instruction override.",
      "type": "USER"
    }
  ],
  "final_answer": "Refused: instruction-override attempt detected.",
  "inference_path": [
    {
      "depends_on": [
        "E1"
      ],
      "step": "Detect injection; refuse to comply with override."
    }
  ],
  "merit": {
    "helpfulness": 1,
    "honesty": 5,
    "safety": 5
  },
  "proof_status": "INCONCLUSIVE",
  "schema_version": "1",
  "what_would_change": [
    "A legitimate request with context and without override attempts."
  ]
}